{
  "schema_version": 1,
  "story_id": "STORY-009",
  "role": "qa",
  "findings": [
    {
      "role": "qa",
      "target_file": "acceptance.feature",
      "target_section": "Scenario: An untouched contract is verified against its committed state",
      "risk_dimension": "ambiguity",
      "statement": "\"the contract as committed\" names no revision. HEAD, the merge-base with the default branch, the newest commit touching the story directory, and the first commit in which the story computed ready each give a different verdict for the same working tree, and the request does not choose. No scenario about the baseline can be judged until one is named, and the choice also decides whether a trunk branch name has to become configuration."
    },
    {
      "role": "qa",
      "target_file": "acceptance.feature",
      "target_section": "Scenario: A contract edit committed during implementation",
      "risk_dimension": "coverage",
      "statement": "The request closes exactly one laundering route, re-running 'amigos check'. If the baseline is HEAD, 'git add .amigos && git commit' or 'git commit --amend' moves the baseline in the same move the ticket set out to prevent, and this repository's own history (3067aee 'Contract: STORY-004' then ac5f549 'Implement /amigos') puts contract and implementation commits on the same linear branch, so that route is the normal one. Nothing in the request says what refuses it, and no scenario can be written until it does."
    },
    {
      "role": "qa",
      "target_file": "acceptance.feature",
      "target_section": "Scenario: A contract that has never been committed is refused rather than passed",
      "risk_dimension": "ambiguity",
      "statement": "A story whose contract exists only in the working tree - every story between the /amigos run and the contract commit - has no git baseline. Whether that is exit 1 (evaluated, not verified) or exit 2 (structurally unanswerable, README section 16's meaning, and how verify.NoBaseline behaves today) is unstated, and the two codes are read differently by the pre-commit adapter and by CI. Whether it also stops /implement phase 0 is a second unstated consequence."
    },
    {
      "role": "qa",
      "target_file": "constraints.md",
      "target_section": "Dependencies",
      "risk_dimension": "dependency",
      "statement": "Verification would gain a hard dependency on a git binary and on history containing the story. gate.py is the only module that shells out to git today and it fails closed with GateUnavailable; dor, lint and check have no such dependency. Shallow clones, linked worktrees, a checkout exported without .git, and 'amigos verify --stories-dir <corpus outside the repository>' (the flag README section 22 publishes, and the shape tests/conftest.py's fixture corpus uses) all leave the question unanswerable, and the request says nothing about what happens then."
    },
    {
      "role": "qa",
      "target_file": "constraints.md",
      "target_section": "Technical Constraints",
      "risk_dimension": "feasibility",
      "statement": "A byte comparison between a git blob and a working-tree file can report a difference nobody made: .gitattributes text filters, core.autocrlf and any clean/smudge filter make the two representations legitimately differ. story.hash_inputs() reads raw bytes with read_bytes(). Nothing in the request says which side is normalised, and a verification that fails on an untouched contract destroys the signal the command exists to give."
    },
    {
      "role": "qa",
      "target_file": "constraints.md",
      "target_section": "Technical Constraints",
      "risk_dimension": "compatibility",
      "statement": "'amigos verify --json' publishes {\"baseline\": \"dor.json\"} today; tests/test_verify.py asserts that value and skills/implement/SKILL.md phase 5 instructs the skill to read this command's output. Moving the baseline changes what that key means. Whether the payload keeps the key, gains a revision field, or breaks its schema for existing callers is not settled, and no migration is described."
    },
    {
      "role": "qa",
      "target_file": "intent.md",
      "target_section": "Out of Scope",
      "risk_dimension": "compatibility",
      "statement": "The fate of dor.json.contract_hash is unstated. schemas/dor.schema.json marks it required and describes it as 'the baseline that contract-immutability enforcement will diff against'; tests/test_dogfooding.py asserts the committed hashes describe the files on disk for six stories. Removing it is a schema change touching every committed dor.json; keeping it leaves two baselines in the repository and a reader cannot tell which one a verdict came from."
    },
    {
      "role": "qa",
      "target_file": "constraints.md",
      "target_section": "Invariants",
      "risk_dimension": "invariant",
      "statement": "A requirement that legitimately changes must be able to become the new baseline, or the ready -> contract_change -> amigos_running loop in README section 3 deadlocks and every later verification of that story reports the superseded text as the contract. The request states only that the baseline moves to history; it does not say how a re-agreed contract replaces the one it supersedes, and under some revision choices (merge-base, first-ready commit) it never does."
    },
    {
      "role": "qa",
      "target_file": "intent.md",
      "target_section": "In Scope",
      "risk_dimension": "scope",
      "statement": "The ticket leaves open whether the gate also refuses a contract edit while a story is ready, and the two answers produce different observable systems: refusal is a PreToolUse or pre-commit rejection with a message, detection is only a non-zero exit from a command somebody has to run. Nothing else in the story decides it, so the scenarios cannot state what a caller sees when an implementation agent tries to edit acceptance.feature."
    },
    {
      "role": "qa",
      "target_file": "intent.md",
      "target_section": "In Scope",
      "risk_dimension": "feasibility",
      "statement": "If the gate does refuse contract edits for a ready story, the deadlock argument that produced the .amigos/** exemption applies again and the request does not say which paths stay writable. state.json must stay writable or 'amigos state --set contract_change' - the only escape hatch - is refused; dor.json is rewritten by the validator on every 'amigos check' and committed in this repository, so a pre-commit refusal over the story directory would refuse this project's own closeout commits; a brand-new story is not ready and so is unaffected, but a ready story that needs any correction has no path."
    },
    {
      "role": "qa",
      "target_file": "acceptance.feature",
      "target_section": "Scenario: This story is implemented by the implement skill and leaves that evidence behind",
      "risk_dimension": "testability",
      "statement": "Nothing observable distinguishes an implementation run record written by /implement from one written by hand afterwards, yet v0.5's exit criterion rests on that distinction (docs/versions/v1.0-self-hosting/milestones.md keeps the milestone open until this run produces evidence). The fresh-session requirement in the v0.5 notes is likewise unobservable from the repository. What a reviewer may check must be named, or this scenario is decided by assertion."
    },
    {
      "role": "qa",
      "target_file": "acceptance.feature",
      "target_section": "Scenario: A contract file is deleted or added after the baseline commit",
      "risk_dimension": "coverage",
      "statement": "The request describes edits only. A contract file present in the commit and deleted from the working tree, a story directory renamed, and a file added to the story after the baseline commit are all unaddressed; verify.py today folds every one of these into ABSENT and lists it as changed, which for a deletion is right and for an added file may be a false alarm. No scenario covers a missing or extra file."
    }
  ]
}
